{
    "schema_version": "backup.v3",
    "job_id": "01JRZX9K2Q4M8N7P6T5V3W2Y1B",
    "manifest_b64": "ewogICAgIm1hbmlmZXN0X3ZlcnNpb24iOiAiYmFja3VwLW1hbmlmZXN0LnYzIiwKICAgICJhcnRpZmFjdF9pZCI6ICIwMUpaWDlLMlE0TThON1A2VDVWM1cyWTFCMCIsCiAgICAic2l0ZV9pZCI6ICIwMUpSWlg5SzJRNE04TjdQNlQ1VjNXMlkxQiIsCiAgICAic2l0ZV9rZXlfZmluZ2VycHJpbnQiOiAiTUdSUy00R05YLTNGRFEtSzJNUi0wQjBTLUVTNkYtTlJQMSIsCiAgICAidGFrZW5fYXQiOiAxNzg1MzQwMDAwLAogICAgInNlcXVlbmNlIjogNDMsCiAgICAiZW5jcnlwdGlvbiI6IHsKICAgICAgICAic2NoZW1lIjogInhjaGFjaGEyMHBvbHkxMzA1LXNlY3JldHN0cmVhbS12MSIsCiAgICAgICAgImNodW5rX2J5dGVzIjogMTA0ODU3NiwKICAgICAgICAic3RyZWFtX2hlYWRlciI6ICJpbTFydmVEZkxObTk4dFFKV2w0SHBVMlgxUEE1ajBJUiIKICAgIH0sCiAgICAia2V5X3dyYXBwaW5nIjogewogICAgICAgICJhbGdvcml0aG0iOiAieDI1NTE5LWNyeXB0b19ib3hfc2VhbC12MSIsCiAgICAgICAgInJlY2lwaWVudHMiOiBbCiAgICAgICAgICAgIHsKICAgICAgICAgICAgICAgICJmaW5nZXJwcmludCI6ICJNR1JLLVZUV0ctTUFCNC1BTVdTLVJFM1otS01INy1BRDVDIiwKICAgICAgICAgICAgICAgICJwdWJsaWNfa2V5IjogIlpJaEdINSthZ1BiNGR3a21LZkhHZTg3Y3FWNHlqTnRXUm93a21FZFRYbUU9IiwKICAgICAgICAgICAgICAgICJ3cmFwcGVkX2tleSI6ICJzOTcvajdBTzZEMm40RFJ2TmxpREhiNnlIVnFUazV3cURxSHZpMnhOazFVaFN6WUVzVENEejBzbEd6NHoxa05hc211bXN6T01iRDN3ejdnNXgxNkU0SFNLb0ZGTnl5NG1oa2xqMStSLytzMD0iLAogICAgICAgICAgICAgICAgImxhYmVsIjogIk9wcyBsYXB0b3AiCiAgICAgICAgICAgIH0sCiAgICAgICAgICAgIHsKICAgICAgICAgICAgICAgICJmaW5nZXJwcmludCI6ICJNR1JLLTEzOVYtRFlNSi0wVE1aLTNNOEItN0UwUS1ORTFGIiwKICAgICAgICAgICAgICAgICJwdWJsaWNfa2V5IjogIjhvVFlvSTN5U0hEQys4RnVIc0UzZGlTQ3JKUWpKT1RDd2F3dXhVRlhsWG89IiwKICAgICAgICAgICAgICAgICJ3cmFwcGVkX2tleSI6ICJid0tzVHVWMDJESFYyOHgvZEFheUIyUXZzbTRpN1AzUjYzeTE4V2VhQ1FoN3NnbTE0c2x4TGMwc0kyMGFIeHZKSmNqZ1NBZzdiZ3YyNzc5cG1INkFvUUZIZ21oYnRvN1FyOWQ2Yi9abnhNbz0iLAogICAgICAgICAgICAgICAgImxhYmVsIjogIlNhZmUiCiAgICAgICAgICAgIH0KICAgICAgICBdCiAgICB9LAogICAgImludGVncml0eSI6IHsKICAgICAgICAicGxhaW50ZXh0X3NoYTI1NiI6ICI1MjBkMjY3M2RmMmZmYWM3OGUzZGRiY2U2YjI3NDZiY2UyNjY3MWU0OTAxY2RjNjVhNjJmZTEwZjA4OWY0NWZjIiwKICAgICAgICAiY2lwaGVydGV4dF9zaGEyNTYiOiAiOGNjYjBkMWUwODgzZDQxZWZlNGQxY2ZhYzE4YzU3YmE1MjUwYTQxM2EyODBkM2NlMDg2NjJlNDQxMTNjMDA4OSIsCiAgICAgICAgInBsYWludGV4dF9ieXRlcyI6IDIxNDc0ODM2NDgwLAogICAgICAgICJjaXBoZXJ0ZXh0X2J5dGVzIjogMjE0NzUxODQ2NjQKICAgIH0sCiAgICAic291cmNlIjogewogICAgICAgICJlbmdpbmUiOiAibXlzcWwiLAogICAgICAgICJlbmdpbmVfdmVyc2lvbiI6ICI4LjAuMzYiLAogICAgICAgICJjb21wcmVzc2VkIjogZmFsc2UsCiAgICAgICAgImNvbXByZXNzaW9uIjogIm5vbmUiCiAgICB9Cn0K",
    "manifest_sha256": "6f58bd4711974672465e6bfc1b5b56ee2b61dd632cd9cd72aa57d4d2689a6564",
    "manifest_signature": "/6rT4MyWvbGYXpSWAPZcj2/KDUDHWylt8e3f87ScCEyCyskequGbvaUrFZDtHjcgd/HUINEql2/AtmvFpZplCg==",
    "artifact_sha256": "6d75fe143a2bd66d7190aae125c14f210200cd9eef91289483b8806ea62c01b9",
    "artifact_crc32c": "7842fa6c",
    "artifact_bytes": 21475186437,
    "upload_mode": "direct"
}
